{
  "schema_version": "utopic-runner/v1",
  "run_id": "$RUN_ID",
  "task": "chat",
  "model": "unit-text",
  "input": {
    "messages": [
      {
        "role": "user",
        "content": "hello"
      }
    ]
  },
  "options": {
    "endpoint": "/v1/chat/completions",
    "modality": "text",
    "engine": "native-text",
    "runtime": "native",
    "runner": "utopic-runner",
    "native_status": "ready",
    "outputs": [
      "text"
    ],
    "supported_backends": [
      "metal",
      "cuda",
      "cpu"
    ],
    "model_cache_path": "$MODEL_PATH",
    "model_path": "$MODEL_PATH",
    "requirements": {
      "allow_cpu": true
    },
    "oom_policy": {
      "action": "fail_before_runner",
      "min_gpu_memory_gib": null,
      "min_ram_gib": null,
      "allow_cpu": true
    },
    "max_tokens": 16
  },
  "output_dir": "$OUTPUT_DIR",
  "progress_path": "$PROGRESS_PATH"
}
